{
	"ext": [],
	"html": [
		[
			"b",
			"bdi",
			"del",
			"i",
			"ins",
			"u",
			"font",
			"big",
			"small",
			"sub",
			"sup",
			"h1",
			"h2",
			"h3",
			"h4",
			"h5",
			"h6",
			"cite",
			"code",
			"em",
			"s",
			"strike",
			"strong",
			"tt",
			"var",
			"div",
			"center",
			"blockquote",
			"ol",
			"ul",
			"dl",
			"table",
			"caption",
			"pre",
			"ruby",
			"rb",
			"rp",
			"rt",
			"rtc",
			"p",
			"span",
			"abbr",
			"dfn",
			"kbd",
			"samp",
			"data",
			"time",
			"mark",
			"tr",
			"td",
			"th",
			"q",
			"bdo"
		],
		[
			"li",
			"dt",
			"dd"
		],
		[
			"br",
			"wbr",
			"hr",
			"meta",
			"link"
		]
	],
	"namespaces": {
		"0": "",
		"6": "File",
		"10": "Template",
		"14": "Category",
		"828": "Module"
	},
	"nsid": {
		"": 0,
		"file": 6,
		"template": 10,
		"category": 14,
		"module": 828
	},
	"functionHook": [
		"msgnw"
	],
	"variable": [
		"!",
		"=",
		"pageid",
		"articlepath",
		"server",
		"servername",
		"scriptpath",
		"stylepath"
	],
	"parserFunction": [
		{
			"msgnw": "msgnw",
			"pageid": "pageid",
			"articlepath": "articlepath",
			"server": "server",
			"servername": "servername",
			"scriptpath": "scriptpath",
			"stylepath": "stylepath"
		},
		{
			"!": "!",
			"=": "="
		},
		[
			"msg",
			"raw"
		],
		[
			"subst",
			"safesubst"
		]
	],
	"doubleUnderscore": [
		[],
		[],
		{},
		{}
	],
	"protocol": "bitcoin:|ftp://|ftps://|geo:|git://|gopher://|http://|https://|irc://|ircs://|magnet:|mailto:|matrix:|mms://|news:|nntp://|redis://|sftp://|sip:|sips:|sms:|ssh://|svn://|tel:|telnet://|urn:|wikipedia://|worldwind://|xmpp:|commonsfinder://",
	"interwiki": [],
	"img": {},
	"redirection": [
		"#redirect"
	],
	"variants": []
}
